{
  "$schema": "https://raw.githubusercontent.com/TheModdedChicken/ManiaKV/main/ManiaKV/config-schema.json",
  "schemaVersion": "1.0",
  "window" : {
    "windowWidth": 594,
    "windowHeight": 334
  },
  "stages": [
    {
      "id": "2k",
      "keys": [ "A", "S" ],
      "characters": [ "bongoCat2k" ],
      "hotkey": 2,
      "background": "background.png",
      "table": "table.png"
    },
    {
      "id": "3k",
      "keys": [ "A", "S", "D" ],
      "characters": [ "bongoCat4k" ],
      "hotkey": 3,
      "background": "background.png",
      "table": "table.png"
    },
    {
      "id": "4k",
      "keys": [ "A", "S", "SEMI_COLON", "SINGLE_QUOTE" ],
      "characters": [ "bongoCat4k" ],
      "hotkey": 4,
      "background": "background.png",
      "table": "table.png"
    },
    {
      "id": "6k",
      "keys": [ "A", "S", "D", "L", "SEMI_COLON", "SINGLE_QUOTE" ],
      "characters": [ "bongoCat4k", "bongoCat2k" ],
      "hotkey": 6,
      "background": "background.png",
      "table": "table.png"
    },
    {
      "id": "7k",
      "keys": [ "A", "S", "D", "SPACE", "L", "SEMI_COLON", "SINGLE_QUOTE" ],
      "characters": [ "bongoCat4k", "bongoCat4k" ],
      "hotkey": 7,
      "background": "background.png",
      "table": "table.png"
    },
    {
      "id": "8k",
      "keys": [ "A", "S", "D", "F", "K", "L", "SEMI_COLON", "SINGLE_QUOTE" ],
      "characters": [ "bongoCat4k", "bongoCat4k" ],
      "hotkey": 8,
      "background": "background.png",
      "table": "table.png"
    }
  ],
  "characters": [
    {
      "id": "bongoCat4k",
      "body": "bongoCat4k/body.png",
      "instrument": "bongoCat4k/instrument.png",
      "keys": 4,
      "textures": {
        "leftIdle": "bongoCat4k/leftPaw_idle.png",
        "rightIdle": "bongoCat4k/rightPaw_idle.png",
        "key1": "bongoCat4k/leftPaw_key1.png",
        "key2": "bongoCat4k/leftPaw_key2.png",
        "key1-2": "bongoCat4k/leftPaw_key1-2.png",
        "key3": "bongoCat4k/rightPaw_key3.png",
        "key4": "bongoCat4k/rightPaw_key4.png",
        "key3-4": "bongoCat4k/rightPaw_key3-4.png"
      }
    },
    {
      "id": "bongoCat2k",
      "body": "bongoCat2k/body.png",
      "instrument": "bongoCat2k/instrument.png",
      "keys": 2,
      "textures": {
        "leftIdle": "bongoCat2k/leftPaw_idle.png",
        "rightIdle": "bongoCat2k/rightPaw_idle.png",
        "key1": "bongoCat2k/leftPaw_key1.png",
        "key2": "bongoCat2k/rightPaw_key2.png"
      }
    }
  ]
}